PubmedID,Title,Publication Date,Non-academic Author(s),Company Affiliation(s),Corresponding Author Email
40720880,Concordance Between Survey and Electronic Health Record Data in the COVID-19 Citizen Science Study: Retrospective Cohort Analysis.,2025-Jul-28,Alan F Kaul,"Medical Outcomes Management, Inc., Sharon, MA, United States.",
40720792,Hyaluronan Ameliorates Viral Pneumonia in Mice and Humans by Inhibiting E2F1 Transcription Factor.,2025-Jul-28,Daniel J Zaccaro; Jane S Der,"7 Social & Scientific Systems, Inc., a DLH Holdings Corp. company, Durham, United States.; 7 Social & Scientific Systems, Inc., a DLH Holdings Corp. company, Durham, United States.",garantziotis@niehs.nih.gov.
40715253,Development of a time-resolved fluorescence-based lateral flow immunoassay for rapid and sensitive diagnosis of Middle East respiratory syndrome.,2025-Jul-25,Hyunghoon Kim,"Precision Biosensor, Inc., Daejeon, 34036, Republic of Korea.",ksi@kbsi.re.kr.
40714926,Mental health of urban Black women experiencing intimate partner violence since the start of the COVID-19 pandemic.,2025-Jul-27,Elizabeth Rice,"Lac Courte Oreilles Women's Shelter & Tribal Governments TTA at Red Wind Consulting, Inc, Wisconsin, USA.",
40714526,Strengthening spontaneous reporting-based signal detection during a pandemic with cases from electronic health records using a natural language processing tool.,2025-Jul-25,L Davidson,"The Netherlands Pharmacovigilance Centre Lareb, 's-Hertogenbosch, the Netherlands.",g.j.von_kreijfelt@lumc.nl.
